{
  "schema_version": "1.2.0",
  "run_id": "poc-20261019T054801Z-ff1bfb",
  "status": "partial",
  "generated_at": "2026-10-19T05:51:26.129353+00:00",
  "rule": {
    "rule_id": "asia-executive-news",
    "version": "1.5.7",
    "sha256": "7217d0004ff3bd46eeec7a977bdff45346ae7dc386b29e41b59ceb3945bf8bf1"
  },
  "search": {
    "approach": "custom-bing",
    "custom_configurations": [
      {
        "configuration_id": "regulatory-official",
        "instance_name": "asia-news-regulatory-official"
      },
      {
        "configuration_id": "aia-primary",
        "instance_name": "asia-news-aia-primary"
      },
      {
        "configuration_id": "corporate-exchange",
        "instance_name": "asia-news-corporate-exchange"
      },
      {
        "configuration_id": "authoritative-media",
        "instance_name": "asia-news-authoritative-media"
      }
    ]
  },
  "topic": "Material developments affecting AIA, its 18 markets, insurance regulation, or its named major competitors",
  "search_window": {
    "start_date": "2026-10-05",
    "end_date": "2026-10-19",
    "timezone": "Asia/Hong_Kong"
  },
  "window": {
    "start_date": "2026-10-12",
    "end_date": "2026-10-19",
    "timezone": "Asia/Hong_Kong"
  },
  "counts": {
    "total": 16,
    "in_window": 3,
    "out_of_window": 13,
    "unknown_date": 0,
    "eligible_for_brief": 3
  },
  "items": [
    {
      "source_item_id": "src-0d37f7b0bbdc",
      "title": "Manulife launches proprietary enterprise AI platform across global operations",
      "publisher": "Manulife",
      "published_date": "2026-10-13",
      "grounded_note": "Manulife launched a proprietary enterprise AI platform providing a common operating environment for teams to build, deploy and manage AI solutions across its markets and jurisdictions. The platform embeds reusable components and security, risk and governance controls so previously approved use cases can be deployed more rapidly. Manulife said enterprise AI had generated US$300 million in value by year-end 2025 and is expected to produce US$1 billion in cumulative value by 2027 through expense reductions, revenue uplift, fraud reduction and growth absorption.",
      "query_ids": [
        "competitor-official-material-moves"
      ],
      "languages": [
        "English"
      ],
      "source_links": [
        {
          "url": "https://www.manulife.com/ca/en/about-us/news/manulife-launches-enterprise-ai-platform",
          "title": "Manulife launches proprietary enterprise AI platform across global operations",
          "configuration_id": "corporate-exchange",
          "source_tier": "primary",
          "source_type": "company",
          "market": "asia",
          "url_specificity": "specific_article"
        }
      ],
      "configuration_id": "corporate-exchange",
      "source_tier": "primary",
      "source_type": "company",
      "source_market": "asia",
      "market": "Global, including Manulife's Asian markets",
      "entities": [
        "Manulife",
        "Manulife Financial",
        "Manulife Asia"
      ],
      "topic": "external_environment",
      "signal_type": "technology_operational_risk",
      "subject_type": "competitor",
      "content_type": "corporate",
      "event_scope": "group_regional",
      "url_specificity": "specific_article",
      "source_quality_note": "At least one native citation appears to target a specific article or release.",
      "freshness_status": "in_window",
      "eligible_for_brief": true,
      "ineligibility_reason": null
    },
    {
      "source_item_id": "src-ccbf7610a338",
      "title": "Manulife Asia promotes Andy Bruce to Chief Information Officer",
      "publisher": "Asia Insurance Review",
      "published_date": "2026-10-12",
      "grounded_note": "Manulife Asia promoted Andy Bruce to Chief Information Officer, making the appointment at the regional level. Bruce previously served as Manulife's Chief Information Officer for Hong Kong and Macau, where he led a major technology-delivery portfolio. The promotion places an executive with experience in technology delivery and team development into Manulife Asia's senior information-technology leadership.",
      "query_ids": [
        "competitor-authoritative-media"
      ],
      "languages": [
        "English"
      ],
      "source_links": [
        {
          "url": "https://www.asiainsurancereview.com/News/View-NewsLetter-Article?Type=eDaily&id=97199",
          "title": "Manulife Asia promotes Andy Bruce to Chief Information Officer",
          "configuration_id": "authoritative-media",
          "source_tier": "authoritative_media",
          "source_type": "media",
          "market": "asia",
          "url_specificity": "specific_article"
        }
      ],
      "configuration_id": "authoritative-media",
      "source_tier": "authoritative_media",
      "source_type": "media",
      "source_market": "asia",
      "market": "Asia Pacific",
      "entities": [
        "Manulife",
        "Manulife Asia",
        "Andy Bruce"
      ],
      "topic": "external_environment",
      "signal_type": "leadership_change",
      "subject_type": "competitor",
      "content_type": "leadership",
      "event_scope": "individual",
      "url_specificity": "specific_article",
      "source_quality_note": "At least one native citation appears to target a specific article or release.",
      "freshness_status": "in_window",
      "eligible_for_brief": true,
      "ineligibility_reason": null
    },
    {
      "source_item_id": "src-a2c1e1541c04",
      "title": "AXA Future Risks Report ranks AI and big-data risks first among experts",
      "publisher": "AXA",
      "published_date": "2026-10-12",
      "grounded_note": "AXA published its 13th Future Risks Report with Ipsos, reporting that artificial-intelligence and big-data risks ranked first among surveyed experts for the first time, rising from fourth place in 2025 and overtaking climate change. Among experts who placed AI among their leading risks, 54% viewed it as rapidly emerging while 9% believed public authorities were well prepared. The report also linked ageing, lower birth rates, longevity and changing family structures to evolving insurance needs in health, dependency protection, savings, retirement and wealth transfer.",
      "query_ids": [
        "competitor-official-material-moves"
      ],
      "languages": [
        "English"
      ],
      "source_links": [
        {
          "url": "https://www.axa.com/en/press/press-releases/axa-future-risks-report-2026-artificial-intelligence-becomes-%20experts-top-concern-ahead-of-climate-change",
          "title": "AXA Future Risks Report ranks AI and big-data risks first among experts",
          "configuration_id": "corporate-exchange",
          "source_tier": "primary",
          "source_type": "company",
          "market": "global",
          "url_specificity": "specific_article"
        }
      ],
      "configuration_id": "corporate-exchange",
      "source_tier": "primary",
      "source_type": "company",
      "source_market": "global",
      "market": "Global, with relevance to Asian insurance markets",
      "entities": [
        "AXA",
        "AXA Group",
        "Ipsos"
      ],
      "topic": "external_environment",
      "signal_type": "technology_operational_risk",
      "subject_type": "competitor",
      "content_type": "research_thought_leadership",
      "event_scope": "market_sector",
      "url_specificity": "specific_article",
      "source_quality_note": "At least one native citation appears to target a specific article or release.",
      "freshness_status": "in_window",
      "eligible_for_brief": true,
      "ineligibility_reason": null
    },
    {
      "source_item_id": "src-860704820003",
      "title": "Mainland China issues Property Insurance Company Insurance Product Development Management Provisions",
      "publisher": "National Financial Regulatory Administration",
      "published_date": "2026-10-09",
      "grounded_note": "The National Financial Regulatory Administration issued rules governing property insurers’ product-development organization, responsibilities and workflows. Property insurers must establish internal product-development management systems covering organizational structure, division of functions, processes, assessment and incentives; the rules also encourage products aligned with public protection needs and social development. The provisions take effect on November 1, 2026, replacing the 2016 product-development guidelines and a 2014 emergency notice on property-insurance product development and sales.",
      "query_ids": [
        "regulatory-greater-china"
      ],
      "languages": [
        "English"
      ],
      "source_links": [
        {
          "url": "https://www.nfra.gov.cn/cn/view/pages/ItemDetail.html?docId=1274236&itemId=928",
          "title": "Mainland China issues Property Insurance Company Insurance Product Development Management Provisions",
          "configuration_id": "regulatory-official",
          "source_tier": "primary",
          "source_type": "regulator",
          "market": "mainland_china",
          "url_specificity": "specific_article"
        }
      ],
      "configuration_id": "regulatory-official",
      "source_tier": "primary",
      "source_type": "regulator",
      "source_market": "mainland_china",
      "market": "Mainland China",
      "entities": [
        "National Financial Regulatory Administration"
      ],
      "topic": "government_regulatory",
      "signal_type": "final_rule",
      "subject_type": "regulator",
      "content_type": "regulatory",
      "event_scope": "market_sector",
      "url_specificity": "specific_article",
      "source_quality_note": "At least one native citation appears to target a specific article or release.",
      "freshness_status": "out_of_window",
      "eligible_for_brief": false,
      "ineligibility_reason": "outside_brief_window"
    },